{
  "schemaVersion": 1,
  "snapshotDate": "2026-07-18",
  "methodology": "Vendor-neutral capability records distilled from current official feature catalogs; equivalent marketing labels and closely related controls may share one workflow record.",
  "implementationPolicy": {
    "localOnly": true,
    "aiImplementation": "local-deterministic"
  },
  "products": [
    {
      "name": "Adobe Acrobat Pro",
      "source": "https://helpx.adobe.com/acrobat/using/explore-acrobat-tools.html"
    },
    {
      "name": "Foxit PDF Editor",
      "source": "https://www.foxit.com/pdf-editor/pricing/"
    },
    {
      "name": "Nitro PDF Pro",
      "source": "https://www.gonitro.com/user-guide/nitro-pdf-for-windows"
    },
    {
      "name": "PDF-XChange Editor Plus",
      "source": "https://cdn.pdf-xchange.com/pdf-xchange-products-comparison-chart"
    },
    {
      "name": "ABBYY FineReader PDF",
      "source": "https://pdf.abbyy.com/media/uicccm1b/brochure-finereaderpdf-full-feature-list-en.pdf"
    },
    {
      "name": "Bluebeam Revu",
      "source": "https://support.bluebeam.com/revu/subscription/subscription-features.html"
    },
    {
      "name": "callas pdfToolbox",
      "source": "https://callassoftware.com/products/pdftoolbox/"
    },
    {
      "name": "Enfocus PitStop Pro",
      "source": "https://www.enfocus.com/en/pitstop-pro"
    },
    {
      "name": "PDF Expert",
      "source": "https://pdfexpert.com/features"
    },
    {
      "name": "Qoppa PDF Studio",
      "source": "https://www.qoppa.com/pdfstudio/features/"
    },
    {
      "name": "Wondershare PDFelement",
      "source": "https://pdf.wondershare.com/tech-spec.html"
    },
    {
      "name": "Tungsten Power PDF",
      "source": "https://docshield.tungstenautomation.com/PowerPDF/en_US/2025.3-jlrwz2ja2j/help/PowerPDF_help/PowerPDF_help/c_introduction.html"
    }
  ],
  "requiredCapabilityIds": [
    "accessibility.alt-text",
    "accessibility.artifact-management",
    "accessibility.auto-tag",
    "accessibility.check",
    "accessibility.color-contrast",
    "accessibility.document-language-title",
    "accessibility.font-unicode-mapping",
    "accessibility.form-semantics",
    "accessibility.heading-list-structure",
    "accessibility.links-bookmarks",
    "accessibility.reading-order",
    "accessibility.remediate-tags",
    "accessibility.report-export",
    "accessibility.screen-reader-permissions",
    "accessibility.table-semantics",
    "admin.audit-telemetry",
    "admin.data-residency",
    "admin.deployment-packaging",
    "admin.identity-roles",
    "admin.licensing",
    "admin.plugin-allowlist",
    "admin.policy-configuration",
    "admin.sso-scim",
    "admin.update-management",
    "admin.usage-reporting",
    "aec.batch-link",
    "aec.batch-slip-sheet",
    "aec.collaborative-review-sessions",
    "aec.custom-columns-formulas",
    "aec.geospatial-documents",
    "aec.legends",
    "aec.markup-toolsets",
    "aec.markups-list",
    "aec.measurement",
    "aec.measurement-toolset",
    "aec.offline-projects",
    "aec.revision-overlay",
    "aec.revision-status-workflows",
    "aec.scale-calibration",
    "aec.sets-drawing-log",
    "aec.sheet-metadata-tags",
    "aec.spaces-regions",
    "aec.takeoff",
    "ai.accessibility-suggestions",
    "ai.annotation-assist",
    "ai.ask-document",
    "ai.explain",
    "ai.extract-structured-data",
    "ai.form-extraction",
    "ai.generate-bookmarks",
    "ai.generate-images",
    "ai.multi-document-analysis",
    "ai.provider-policy-controls",
    "ai.rewrite-proofread",
    "ai.smart-redaction",
    "ai.source-citations",
    "ai.summarize",
    "ai.translate",
    "automation.action-sequences",
    "automation.api",
    "automation.batch-print",
    "automation.cli-batch",
    "automation.conditional-workflows",
    "automation.javascript",
    "automation.job-queue-retry",
    "automation.preflight-server",
    "automation.processing-reports",
    "automation.scheduled-jobs",
    "automation.variables-presets",
    "automation.watch-folders",
    "automation.webhooks",
    "collaboration.access-expiration",
    "collaboration.activity-notifications",
    "collaboration.projects-workspaces",
    "collaboration.real-time-review",
    "collaboration.share-links",
    "collaboration.version-history",
    "color.convert",
    "color.output-intents",
    "color.spot-colors",
    "compare.annotations",
    "compare.batch",
    "compare.content",
    "compare.cross-format",
    "compare.overlay",
    "compare.package",
    "compare.pixel",
    "compare.report-export",
    "compare.side-by-side",
    "convert.html-to-pdf",
    "convert.images-to-pdf",
    "convert.office-to-pdf",
    "create.blank-pdf",
    "create.cad-to-pdf",
    "create.clipboard-to-pdf",
    "create.multiformat-combine",
    "create.postscript-to-pdf",
    "create.print-to-pdf",
    "dms.checkin-checkout",
    "dms.conflict-resolution",
    "dms.document-locking",
    "dms.offline-sync",
    "dms.repository-connectors",
    "dms.retention-records",
    "document.actions-javascript",
    "document.article-threads",
    "document.attachments-manage",
    "document.backgrounds",
    "document.bates-numbering",
    "document.bookmarks-author",
    "document.close",
    "document.destinations-author",
    "document.download.original",
    "document.embedded-files",
    "document.flatten-content",
    "document.layers-manage",
    "document.metadata-edit",
    "document.open.drag-drop",
    "document.open.local",
    "document.optional-content-groups",
    "document.watermarks",
    "edit.add-text",
    "edit.find-replace",
    "edit.headers-footers",
    "edit.images",
    "edit.links",
    "edit.object-properties",
    "edit.spellcheck",
    "edit.text",
    "edit.text-reflow",
    "edit.vector-objects",
    "export.excel",
    "export.html-xml",
    "export.images",
    "export.powerpoint",
    "export.selected-region",
    "export.text-rtf",
    "export.word",
    "forms.author",
    "forms.barcode-fields",
    "forms.calculate",
    "forms.detect-fields",
    "forms.distribute-collect",
    "forms.fill-save",
    "forms.flatten",
    "forms.import-export-data",
    "forms.javascript-actions",
    "forms.signature-fields",
    "forms.source-bound-acroform-fill-save",
    "forms.static-to-fillable",
    "forms.submit-reset",
    "forms.tab-order-tooltips",
    "forms.validate",
    "forms.xfa-compatibility",
    "geospatial.inspect-measure-markup",
    "integrations.browser-capture",
    "integrations.cad-bim",
    "integrations.cloud-storage",
    "integrations.email",
    "integrations.esign-providers",
    "integrations.events-webhooks",
    "integrations.office-addins",
    "integrations.sensitivity-labels",
    "ocr.batch-recognition",
    "ocr.cleanup",
    "ocr.editable-output",
    "ocr.export-layout-preserving",
    "ocr.language-detection-selection",
    "ocr.recognize-text",
    "ocr.screenshot-capture",
    "ocr.suspect-review",
    "ocr.table-recognition",
    "ocr.user-dictionaries-training",
    "ocr.zones-layout",
    "optimize.compress",
    "optimize.fast-web-view",
    "pages.copy-between-documents",
    "pages.crop",
    "pages.delete",
    "pages.duplicate",
    "pages.extract",
    "pages.insert",
    "pages.insert-blank",
    "pages.labels-numbering",
    "pages.merge",
    "pages.page-boxes",
    "pages.reorder",
    "pages.replace",
    "pages.resize",
    "pages.reverse-interleave",
    "pages.rotate",
    "pages.split",
    "pages.split-by-rule",
    "pages.transitions",
    "platform.plugins.capability-conflicts",
    "platform.plugins.catalog",
    "platform.plugins.install",
    "platform.plugins.lifecycle",
    "platform.plugins.package-verification",
    "platform.plugins.registry",
    "platform.plugins.upgrade-rollback",
    "platform.plugins.version-compatibility",
    "portfolios.create",
    "portfolios.custom-layout",
    "portfolios.metadata-search",
    "portfolios.view-extract",
    "preflight.certified-pdf",
    "preflight.fixups",
    "preflight.profiles",
    "preflight.reports",
    "print.barcode-decoration",
    "print.bleed-marks",
    "print.font-inspection-embedding",
    "print.image-resolution-compression",
    "print.imposition",
    "print.ink-coverage",
    "print.output-preview",
    "print.overprint-preview",
    "print.separations",
    "print.soft-proof",
    "print.transparency-flattening",
    "print.trapping",
    "print.variable-data",
    "redaction.apply",
    "redaction.batch",
    "redaction.find-patterns",
    "redaction.full-page",
    "redaction.mark",
    "redaction.overlay-labels",
    "redaction.preview",
    "redaction.report",
    "review.annotation-flatten",
    "review.annotation-import-export",
    "review.annotation-properties",
    "review.comment-summary",
    "review.comments",
    "review.comments-to-office",
    "review.custom-stamps",
    "review.drawing-markup",
    "review.file-audio-attachments",
    "review.filter-sort",
    "review.markup-tools",
    "review.measurements",
    "review.notifications-mentions",
    "review.review-tracking",
    "review.shared-review",
    "review.statuses",
    "review.text-markup",
    "review.text-notes-callouts",
    "rich-media.audio-video",
    "rich-media.playback-controls",
    "sanitize.hidden-data",
    "sanitize.metadata",
    "sanitize.selective-content",
    "scan.acquire",
    "scan.append-to-document",
    "scan.duplex-feeder",
    "security.certificate-encryption",
    "security.encryption-aes",
    "security.information-protection-labels",
    "security.javascript-controls",
    "security.open-password",
    "security.permission-controls",
    "security.policy-controls",
    "security.protected-view",
    "security.remove-protection",
    "security.security-envelopes",
    "sign.audit-trail",
    "sign.batch-sign-seal",
    "sign.certificate",
    "sign.certify-document",
    "sign.digital-id-management",
    "sign.electronic",
    "sign.identity-verification",